{"accepted":true,"ambiguous_input_disks":0,"candidate_count":2,"error":"","failure_flags":0,"input_sha256":"dee156945960312d7f1a8351b4cf04148c754d38411c69bfd470ed351fafbe11","interpolation_evaluations":2,"interpolation_patch_sha256":"2bc33d3d4f6163ba5af8982f1272e9544154ed95bc6155a4ee215c4e425c85b3","maximum_depth":64,"precision_bits":128,"refinements_applied":0,"replay_accepted":true,"required_sample_count":25741,"resolution_sha256":"b982a4c4aa0b34a0c902c09086f8ec88e0dfebaf91c844b7d29cd412a2cb1139","schema":"sparkinterval.tg.platt-pt21-stationary-trace.v1","semantic_status":{"analytic_turing_realization_proved":false,"flint_to_mathlib_realization_proved":false,"hardy_z_endpoint_realization_proved":false},"stationary_resolutions":[{"lower_offset":{"denominator":1,"numerator":0},"lower_value":{"hi":{"denominator":649037107316853453566312041152512,"numerator":1947111321950560360698936660328449},"lo":{"denominator":649037107316853453566312041152512,"numerator":1947111321950560360698935586586623}},"midpoint_offset":{"denominator":2,"numerator":1},"midpoint_value":{"hi":{"denominator":21267647932558653966460912964485513216,"numerator":-211126674625668227014518518770005570931},"lo":{"denominator":21267647932558653966460912964485513216,"numerator":-211126674625668227014518599865702544755}},"outer_left_sample":0,"outer_right_sample":2,"stream":"main","upper_offset":{"denominator":1,"numerator":1},"upper_value":{"hi":{"denominator":649037107316853453566312041152512,"numerator":649037107316853453566312578023425},"lo":{"denominator":649037107316853453566312041152512,"numerator":649037107316853453566311504281599}}},{"lower_offset":{"denominator":1,"numerator":10},"lower_value":{"hi":{"denominator":649037107316853453566312041152512,"numerator":1947111321950560360698936660328449},"lo":{"denominator":649037107316853453566312041152512,"numerator":1947111321950560360698935586586623}},"midpoint_offset":{"denominator":2,"numerator":21},"midpoint_value":{"hi":{"denominator":10633823966279326983230456482242756608,"numerator":-89461354723060415173531664682040491117},"lo":{"denominator":10633823966279326983230456482242756608,"numerator":-89461354723060415173531705229888978029}},"outer_left_sample":10,"outer_right_sample":12,"stream":"main","upper_offset":{"denominator":1,"numerator":11},"upper_value":{"hi":{"denominator":649037107316853453566312041152512,"numerator":649037107316853453566312578023425},"lo":{"denominator":649037107316853453566312041152512,"numerator":649037107316853453566311504281599}}}],"upstream_commit":"42b21426718e542daa2b006dc05ea2d7f26426e6"}
